{
  "schema_version": "0.1",
  "domain": {
    "id": "chiller-pilot",
    "version": "0.1.0",
    "digest": "sha256:c1fb0164a86c53728022766c161fdea56caad9847892b2fdae07afb12370ef9a"
  },
  "origin": {
    "kind": "composition"
  },
  "kinds": [
    {
      "kind": "chiller_large",
      "instances": [
        {
          "names": [
            "CH-1",
            "CH-2"
          ],
          "area": "Chiller hall"
        }
      ],
      "readings": [
        {
          "channel": "chiller_large.chw_supply_temp",
          "observes": "chw_supply",
          "unit": "degC",
          "value_type": "number",
          "range": {
            "min": 0,
            "max": 25
          },
          "resolution": 0.1,
          "initial": 6.5,
          "noise": {
            "model": "gaussian",
            "sigma": 0.05
          },
          "cadence": {
            "mode": "periodic",
            "period_s": 10
          },
          "availability": {
            "uptime": 0.999,
            "mttr_s": 600
          },
          "absence": "signal",
          "tag": "TT",
          "basis": "library_instrument",
          "instrument": {
            "id": "streamsim/rtd",
            "version": 1,
            "ref": "streamsim/rtd@1",
            "digest": "sha256:bceb694b0f3a120a3889afe298ebe5580e6e287af8e8a22e7b982b5eb41f084c"
          },
          "recorded_in": "composition"
        },
        {
          "channel": "chiller_large.chw_return_temp",
          "observes": "chw_return",
          "unit": "degC",
          "value_type": "number",
          "range": {
            "min": 0,
            "max": 35
          },
          "resolution": 0.1,
          "initial": 9.73729,
          "noise": {
            "model": "gaussian",
            "sigma": 0.05
          },
          "cadence": {
            "mode": "periodic",
            "period_s": 10
          },
          "availability": {
            "uptime": 0.999,
            "mttr_s": 600
          },
          "absence": "signal",
          "tag": "TT",
          "basis": "library_instrument",
          "instrument": {
            "id": "streamsim/rtd",
            "version": 1,
            "ref": "streamsim/rtd@1",
            "digest": "sha256:bceb694b0f3a120a3889afe298ebe5580e6e287af8e8a22e7b982b5eb41f084c"
          },
          "recorded_in": "composition"
        },
        {
          "channel": "chiller_large.cond_temp",
          "observes": "cond_temp",
          "unit": "degC",
          "value_type": "number",
          "range": {
            "min": 10,
            "max": 60
          },
          "resolution": 0.1,
          "initial": 31.9931,
          "noise": {
            "model": "gaussian",
            "sigma": 0.05
          },
          "cadence": {
            "mode": "periodic",
            "period_s": 10
          },
          "availability": {
            "uptime": 0.999,
            "mttr_s": 600
          },
          "absence": "signal",
          "tag": "TT",
          "basis": "library_instrument",
          "instrument": {
            "id": "streamsim/rtd",
            "version": 1,
            "ref": "streamsim/rtd@1",
            "digest": "sha256:bceb694b0f3a120a3889afe298ebe5580e6e287af8e8a22e7b982b5eb41f084c"
          },
          "recorded_in": "composition"
        },
        {
          "channel": "chiller_large.power",
          "observes": "power",
          "unit": "kW",
          "value_type": "number",
          "range": {
            "min": 0,
            "max": 1100
          },
          "resolution": 0.1,
          "initial": 184.902,
          "noise": {
            "model": "gaussian",
            "sigma": 2.2
          },
          "cadence": {
            "mode": "periodic",
            "period_s": 15
          },
          "availability": {
            "uptime": 0.999,
            "mttr_s": 600
          },
          "absence": "signal",
          "tag": "JT",
          "basis": "library_instrument",
          "instrument": {
            "id": "streamsim/power-meter",
            "version": 1,
            "ref": "streamsim/power-meter@1",
            "digest": "sha256:d2d2e745c5cb4e16a75a348c0ca43869c215400e56e9ef30743c9c4bdc941c81"
          },
          "recorded_in": "composition"
        },
        {
          "channel": "chiller_large.chw_flow",
          "observes": "chw_flow",
          "unit": "m3/h",
          "value_type": "number",
          "range": {
            "min": 0,
            "max": 800
          },
          "resolution": 0.1,
          "initial": 440,
          "noise": {
            "model": "gaussian",
            "sigma": 2.4
          },
          "cadence": {
            "mode": "periodic",
            "period_s": 5
          },
          "availability": {
            "uptime": 0.999,
            "mttr_s": 600
          },
          "absence": "signal",
          "tag": "FT",
          "basis": "library_instrument",
          "instrument": {
            "id": "streamsim/mag-flow-meter",
            "version": 1,
            "ref": "streamsim/mag-flow-meter@1",
            "digest": "sha256:e233724c219cba8709bd042ccfad87bb053391d8d5854cbd638716a7dd5a6e3a"
          },
          "recorded_in": "composition"
        }
      ],
      "dynamics": [
        {
          "target": "load",
          "tier": "F0",
          "inputs": []
        },
        {
          "target": "cond_water_in",
          "tier": "F0",
          "inputs": []
        },
        {
          "target": "tariff",
          "tier": "F0",
          "inputs": []
        },
        {
          "target": "chw_flow",
          "tier": "F0",
          "inputs": []
        },
        {
          "target": "idle",
          "tier": "F1",
          "form": "curve",
          "inputs": [
            {
              "state": "running",
              "coef": 1
            }
          ]
        },
        {
          "target": "cooling",
          "tier": "F1",
          "form": "product",
          "inputs": [
            {
              "state": "running",
              "coef": 1
            },
            {
              "state": "load",
              "coef": 1
            }
          ]
        },
        {
          "target": "part_load",
          "tier": "F1",
          "form": "sum",
          "inputs": [
            {
              "state": "cooling",
              "coef": 0.000355492
            }
          ]
        },
        {
          "target": "supply_error",
          "tier": "F1",
          "form": "curve",
          "inputs": [
            {
              "state": "part_load",
              "coef": 1
            }
          ]
        },
        {
          "target": "chw_supply",
          "tier": "F1",
          "form": "first_order_lag",
          "gain": 1,
          "time_constant_s": 300,
          "dead_time_s": 0,
          "inputs": [
            {
              "state": "setpoint",
              "coef": 1
            },
            {
              "state": "supply_error",
              "coef": 1
            },
            {
              "state": "idle",
              "coef": 5
            }
          ]
        },
        {
          "target": "delta_t",
          "tier": "F1",
          "form": "curve",
          "inputs": [
            {
              "state": "part_load",
              "coef": 1
            },
            {
              "state": "chw_flow",
              "coef": 0.00227273
            }
          ]
        },
        {
          "target": "chw_return",
          "tier": "F1",
          "form": "sum",
          "inputs": [
            {
              "state": "chw_supply",
              "coef": 1
            },
            {
              "state": "delta_t",
              "coef": 1
            }
          ]
        },
        {
          "target": "specific_power",
          "tier": "F1",
          "form": "curve",
          "inputs": [
            {
              "state": "part_load",
              "coef": 1
            },
            {
              "state": "cond_water_in",
              "coef": 1
            }
          ]
        },
        {
          "target": "power",
          "tier": "F1",
          "form": "product",
          "inputs": [
            {
              "state": "running",
              "coef": 1
            },
            {
              "state": "load",
              "coef": 1
            },
            {
              "state": "specific_power",
              "coef": 1
            }
          ]
        },
        {
          "target": "cop_curve",
          "tier": "F1",
          "form": "curve",
          "inputs": [
            {
              "state": "part_load",
              "coef": 1
            },
            {
              "state": "cond_water_in",
              "coef": 1
            }
          ]
        },
        {
          "target": "cop",
          "tier": "F1",
          "form": "product",
          "inputs": [
            {
              "state": "running",
              "coef": 1
            },
            {
              "state": "cop_curve",
              "coef": 1
            }
          ]
        },
        {
          "target": "cond_temp",
          "tier": "F1",
          "form": "first_order_lag",
          "gain": 1,
          "time_constant_s": 600,
          "dead_time_s": 0,
          "inputs": [
            {
              "state": "cond_water_in",
              "coef": 1
            },
            {
              "state": "running",
              "coef": 3
            },
            {
              "state": "part_load",
              "coef": 3
            }
          ]
        },
        {
          "target": "heat_rejected",
          "tier": "F1",
          "form": "first_order_lag",
          "gain": 1,
          "time_constant_s": 120,
          "dead_time_s": 0,
          "inputs": [
            {
              "state": "cooling",
              "coef": 1
            },
            {